{
  "id": "expenses-template-complicated",
  "label": "Template for a freelancer very detailed",
  "userId": "<userId>",
  "date": "<date>",
  "homeOffice": {
    "location": {
      "id": "home-location",
      "label": "<label>",
      "type": "home-base",
      "metadata": {
        "country": "<country>",
        "coordinates": {
          "latitude": 0,
          "longitude": 0
        },
        "population": 0,
        "costIndex": {
          "value": 0,
          "relativeTo": "<relativeTo>",
          "source": "<source>",
          "lastUpdated": "<lastUpdated>"
        }
      }
    },
    "professional": {
      "id": "p6q7r8s9-t0u1-v2w3-x4y5-z6a7b8c9d0e",
      "label": "Professional Expenses",
      "items": [
        {
          "id": "q7r8s9t0-u1v2-w3x4-y5z6-a7b8c9d0e1f",
          "label": "Office",
          "amount": 200,
          "type": "monthly",
          "priority": "survival"
        },
        {
          "id": "r8s9t0u1-v2w3-x4y5-z6a7-b8c9d0e1f2g",
          "label": "Software + Hardware",
          "amount": 100,
          "type": "monthly",
          "priority": "essential"
        },
        {
          "id": "s9t0u1v2-w3x4-y5z6-a7b8-c9d0e1f2g3h",
          "label": "Communication",
          "amount": 100,
          "type": "yearly",
          "priority": "survival"
        },
        {
          "id": "t0u1v2w3-x4y5-z6a7-b8c9-d0e1f2g3h4i",
          "label": "Insurances",
          "amount": 100,
          "type": "monthly",
          "priority": "survival"
        },
        {
          "id": "u1v2w3x4-y5z6-a7b8-c9d0-e1f2g3h4i5j",
          "label": "Fees, Donations",
          "amount": 50,
          "type": "yearly",
          "priority": "nice-to-have"
        },
        {
          "id": "v2w3x4y5-z6a7-b8c9-d0e1-f2g3h4i5j6k",
          "label": "Training & Education",
          "amount": 200,
          "type": "yearly",
          "priority": "nice-to-have"
        },
        {
          "id": "w3x4y5z6-a7b8-c9d0-e1f2-g3h4i5j6k7l",
          "label": "Mobility",
          "amount": 1000,
          "type": "yearly",
          "priority": "essential"
        },
        {
          "id": "x4y5z6a7-b8c9-d0e1-f2g3-h4i5j6k7l8m",
          "label": "Ads",
          "amount": 250,
          "type": "yearly",
          "priority": "nice-to-have"
        }
      ]
    },
    "private": {
      "id": "h8i9j0k1-l2m3-n4o5-p6q7-r8s9t0u1v2w",
      "label": "Private Expenses",
      "items": [
        {
          "id": "i9j0k1l2-m3n4-o5p6-q7r8-s9t0u1v2w3x",
          "label": "Rent + Household",
          "amount": 2500,
          "type": "monthly",
          "priority": "survival"
        },
        {
          "id": "j0k1l2m3-n4o5-p6q7-r8s9-t0u1v2w3x4y",
          "label": "Utilities",
          "amount": 200,
          "type": "monthly",
          "priority": "survival"
        },
        {
          "id": "k1l2m3n4-o5p6-q7r8-s9t0-u1v2w3x4y5z",
          "label": "Groceries",
          "amount": 400,
          "type": "monthly",
          "priority": "survival"
        },
        {
          "id": "l2m3n4o5-p6q7-r8s9-t0u1-v2w3x4y5z6a",
          "label": "Clothing",
          "amount": 250,
          "type": "monthly",
          "priority": "essential"
        },
        {
          "id": "m3n4o5p6-q7r8-s9t0-u1v2-w3x4y5z6a7b",
          "label": "Internet + Phone",
          "amount": 70,
          "type": "monthly",
          "priority": "survival"
        },
        {
          "id": "n4o5p6q7-r8s9-t0u1-v2w3-x4y5z6a7b8c",
          "label": "Mobility",
          "amount": 70,
          "type": "monthly",
          "priority": "essential"
        },
        {
          "id": "o5p6q7r8-s9t0-u1v2-w3x4-y5z6a7b8c9d",
          "label": "Diverse",
          "amount": 50,
          "type": "monthly",
          "priority": "nice-to-have"
        }
      ]
    },
    "financial": {
      "id": "d4e5f6g7-h8i9-j0k1-l2m3-n4o5p6q7r8s",
      "label": "Financial Goals",
      "items": [
        {
          "id": "e5f6g7h8-i9j0-k1l2-m3n4-o5p6q7r8s9t",
          "label": "Savings",
          "amount": 20,
          "type": "percentage",
          "priority": "nice-to-have"
        },
        {
          "id": "f6g7h8i9-j0k1-l2m3-n4o5-p6q7r8s9t0u",
          "label": "Retirement Fund",
          "amount": 15,
          "type": "percentage",
          "priority": "survival"
        },
        {
          "id": "g7h8i9j0-k1l2-m3n4-o5p6-q7r8s9t0u1v",
          "label": "Emergency Fund",
          "amount": 10,
          "type": "percentage",
          "priority": "essential"
        }
      ]
    }
  },
  "onSiteCosts": {
    "location": {
      "id": "work-location",
      "label": "<label>",
      "type": "work-location",
      "metadata": {
        "country": "<country>",
        "coordinates": {
          "latitude": 0,
          "longitude": 0
        },
        "population": 0,
        "costIndex": {
          "value": 0,
          "relativeTo": "<relativeTo>",
          "source": "<source>",
          "lastUpdated": "<lastUpdated>"
        }
      }
    },
    "travelRoute": {
      "id": "travel-route",
      "hourlyRate": 75,
      "route": [
        {
          "type": "train",
          "from": "Galati",
          "to": "Bucharest",
          "duration": 4,
          "cost": 20,
          "currency": "EUR"
        },
        {
          "type": "flight",
          "from": "Bucharest (OTP)",
          "to": "Zurich (ZRH)",
          "cost": 250,
          "currency": "EUR",
          "duration": 2.5,
          "basePrice": 250,
          "maxMultiplier": {
            "season": "summer",
            "value": 1.3
          },
          "adjustedPrice": 325
        },
        {
          "from": "Zurich",
          "to": "Sursee",
          "cost": 40,
          "currency": "CHF",
          "duration": 1
        }
      ]
    },
    "accommodations": {
      "type": "nightly",
      "rating": 4,
      "amount": 180,
      "currency": "CHF",
      "description": "Mid-class business hotel in Sursee",
      "basePrice": 180,
      "maxMultiplier": {
        "season": "summer",
        "value": 1.2
      },
      "adjustedPrice": 216
    },
    "meals": {
      "label": "Daily Business Meals",
      "breakdown": {
        "breakfast": 25,
        "lunch": 45,
        "dinner": 60
      },
      "amount": 130,
      "currency": "CHF",
      "type": "daily"
    }
  }
}
